{
  "contribution_units": 6,
  "formal_eligible": false,
  "items": [
    {
      "normalized_contribution": "Limit the configured dedicated approval-model behavior to Personal Assistant / IM; keep Coding CLI behavior unchanged.",
      "owner_atoms": [
        "O01"
      ],
      "question_index": 1
    },
    {
      "normalized_contribution": "The shared kernel should support either explicitly selecting an approval-classification model or leaving that model unconfigured.",
      "owner_atoms": [
        "O01"
      ],
      "question_index": 1
    },
    {
      "normalized_contribution": "When no dedicated approval model is configured, preserve the existing per-triggering-Agent or run-model classification behavior; only an explicit configuration makes classification use one specified model.",
      "owner_atoms": [
        "O02"
      ],
      "question_index": 2
    },
    {
      "normalized_contribution": "Use the dedicated model only for automatic tool-permission classification; ordinary Agent requests and post-tool continuations must continue using the run model.",
      "owner_atoms": [
        "O04",
        "O08"
      ],
      "question_index": 3
    },
    {
      "normalized_contribution": "Once configured, the dedicated model must handle every automatic tool-permission classification across all PA runtime sources, including their subagents, while paths requiring no classification retain existing behavior.",
      "owner_atoms": [
        "O04"
      ],
      "question_index": 4
    },
    {
      "normalized_contribution": "An explicitly selected model absent from the PA model catalog is a Gateway startup configuration error and must never silently fall back.",
      "owner_atoms": [
        "O03",
        "O07"
      ],
      "question_index": 5
    }
  ],
  "transcript_id": "T1"
}
