{
  "contribution_units": 5,
  "formal_eligible": false,
  "items": [
    {
      "normalized_contribution": "统一审批模型的产品范围仅覆盖个人助手，Coding CLI 保持不变。",
      "owner_atoms": [
        "O01",
        "O08"
      ],
      "question_index": 1
    },
    {
      "normalized_contribution": "个人助手应支持显式选择一个用于自动工具审批分类的模型。",
      "owner_atoms": [
        "O04"
      ],
      "question_index": 2
    },
    {
      "normalized_contribution": "所选审批模型仅用于自动工具审批分类；普通对话和工具调用后的续接仍使用运行模型。",
      "owner_atoms": [
        "O07"
      ],
      "question_index": 2
    },
    {
      "normalized_contribution": "未显式选择审批模型时，保留由触发审批的 Agent 或运行模型执行分类的现有行为，不回退到 llm.default_model。",
      "owner_atoms": [
        "O02"
      ],
      "question_index": 3
    },
    {
      "normalized_contribution": "显式选择的模型若不在个人助手模型目录中，Gateway 必须在启动时报配置错误且不得静默回退。",
      "owner_atoms": [
        "O03"
      ],
      "question_index": 3
    }
  ],
  "transcript_id": "T2"
}
